{
  "schema_version": "1.0.0",
  "last_updated": "2026-04-16",
  "jurisdiction_coverage": [
    "AU"
  ],
  "data_provenance": {
    "acsc_portal_obligations": 25,
    "acsc_verified_by_queries": 89,
    "recommended_obligations": 4,
    "state_territory_obligations": 4,
    "additional_commonwealth_obligations": 2,
    "total": 35
  },
  "source_notes": "25 ACSC obligations extracted and verified via 89-query enumeration of the Single Reporting Portal (cyber.gov.au). 4 recommended/best-practice obligations added from legal research. 4 state/territory obligations added (NSW MNDB, QLD MNDB, VIC OVIC, WA PRIS — WA not yet in force, commencing 1 Jan 2027). 2 additional Commonwealth obligations added (APRA CPS 230 operational risk incident and critical operations disruption). State/territory obligations are flagged with 'state_territory' and 'public_sector_only' fields.",
  "disclaimer": "This tool is for planning and preparedness purposes only and does not constitute legal advice. Entities are responsible for identifying all requirements applicable to them. State/territory obligations are not yet included. Consult qualified legal counsel.",
  "sectors": {
    "395": "Data storage or processing",
    "396": "Defence industry",
    "397": "Energy",
    "398": "Financial services and markets",
    "399": "Food and grocery",
    "400": "Health care and medical",
    "401": "Higher education and research",
    "402": "Space technology",
    "403": "Telecommunications",
    "404": "Transport, including aviation and maritime assets",
    "405": "Water and sewerage",
    "406": "Other"
  },
  "entity_types": {
    "392": "ASX-listed",
    "393": "Critical infrastructure",
    "394": "Foreign investors"
  },
  "obligations": [
    {
      "id": "au-asx-continuous-disclosure",
      "jurisdiction": "AU",
      "obligation_name": "Cyber incident materially affecting the price or value of the securities of an ASX-listed entity",
      "obligation_type": "Mandatory",
      "regulator": "Australian Securities Exchange (ASX)",
      "who_applies_to": "Entities listed on the Australian Securities Exchange.",
      "trigger_condition": "Information that a reasonable person would expect to have a material effect on the price or value of securities.",
      "timeframe": "Immediately.",
      "timeframe_sort_hours": 1,
      "how_to_report": {
        "method": "ASX Online (Market Announcements Platform)",
        "url": null,
        "phone": null,
        "email": null
      },
      "legislative_basis": "ASX Listing Rule 3.1; Corporations Act 2001",
      "description": "If you are an ASX-listed listed entity, you must comply with Listing Rule 3.1 that if you become aware of information that a reasonable person would expect to have a material effect on the price or value of your securities, you must immediately tell the Australian Securities Exchange. Immediate disclosure is not required if the information falls within the exception in Listing Rule 3.1A. * Entities listed on markets other than ASX should consult the relevant guidance material for those markets.",
      "penalty": null,
      "learn_more_links": [
        {
          "text": "Understand how to meet your continuous disclosure requirements",
          "url": "https://www.asx.com.au/content/dam/asx/rules-guidance-notes-waivers/asx-listing-rules/rules/Chapter03.pdf"
        },
        {
          "text": "Further guidance on the continuous disclosure requirement",
          "url": "https://www.asx.com.au/documents/rules/Guidance_Note_8.pdf"
        }
      ],
      "applies_to_sectors": [
        "all"
      ],
      "applies_to_entity_types": [
        "392"
      ],
      "requires_ransom_payment": false,
      "acsc_hash": "e737e3ad81bd",
      "last_verified": "2026-04-16",
      "source": "ACSC Single Reporting Portal (verified by 89-query enumeration)"
    },
    {
      "id": "au-aircraft-incident",
      "jurisdiction": "AU",
      "obligation_name": "Incident affecting an aircraft",
      "obligation_type": "Mandatory",
      "regulator": "Australian Transport Safety Bureau (ATSB)",
      "who_applies_to": "Responsible persons.",
      "trigger_condition": "Aviation accidents or incidents.",
      "timeframe": "As soon as practicable for ‘immediately reportable’ matters Within 72 hours for ‘routine reportable’ matters.",
      "timeframe_sort_hours": 4,
      "how_to_report": {
        "method": "Phone (immediately reportable) or online form (routine)",
        "url": "https://www.atsb.gov.au/mandatory",
        "phone": "1800 011 034 / +61 2 6230 4470",
        "email": null
      },
      "legislative_basis": "Transport Safety Investigation Act 2003",
      "description": "The Australian Transport Safety Bureau’s safety occurrence reporting scheme sets out the requirements for notifying of aviation accidents or incidents. You must call the Australian Transport Safety Bureau for immediately reportable matters. For routine reportable matters, you can report to the Australian Transport Safety Bureau through their online form.",
      "penalty": null,
      "learn_more_links": [
        {
          "text": "Call the ATSB on 1800 011 034 (toll-free, 24 hour)",
          "url": "tel:1800011034"
        },
        {
          "text": "Call the ATSB on +61 2 6230 4470 if outside Australia",
          "url": "tel:+61262304470"
        },
        {
          "text": "Learn more about aviation industry reporting",
          "url": "https://www.atsb.gov.au/aviation-reporting-requirements"
        }
      ],
      "applies_to_sectors": [
        "404"
      ],
      "applies_to_entity_types": [],
      "requires_ransom_payment": false,
      "acsc_hash": "a73bcf4500c3",
      "last_verified": "2026-04-16",
      "source": "ACSC Single Reporting Portal (verified by 89-query enumeration)"
    },
    {
      "id": "au-soci-ci-incident",
      "jurisdiction": "AU",
      "obligation_name": "Cyber incident affecting a critical infrastructure asset",
      "obligation_type": "Mandatory",
      "regulator": "Department of Home Affairs (via ASD's ACSC)",
      "who_applies_to": "Entities responsible for critical infrastructure assets.",
      "trigger_condition": "Significant or relevant impact on a critical infrastructure asset from a cyber security incident.",
      "timeframe": "For a ‘significant impact’ within 12 hours of becoming aware of the incident. For a ‘relevant impact’ within 72 hours of becoming aware of the incident.",
      "timeframe_sort_hours": 12,
      "how_to_report": {
        "method": "Online form or verbal (follow-up in writing required)",
        "url": "https://www.cyber.gov.au/report-and-recover/report/report-a-cyber-security-incident",
        "phone": "1300 292 371",
        "email": null
      },
      "legislative_basis": "Security of Critical Infrastructure Act 2018 (SOCI Act), s30BC & s30BD",
      "description": "You must report a cyber-security incident to the Department of Home Affairs. ASD’s ACSC host the reporting portal via cyber.gov.au and will engage with you on the technical details of the incident, while the Department of Home Affairs will engage for their regulatory functions. The report must either be made electronically through the Australian Signals Directorate’s Australian Cyber Security Centre or verbally. If the initial report was verbal, a written record must be provided within 84 hours for a ‘significant impact’ or within 48 hours of the verbal report being given for a ‘relevant impact’. If you have received an INC number from ASD’s ACSC you may have already completed this reporting requirement.",
      "penalty": "Civil penalty for non-compliance under SOCI Act",
      "learn_more_links": [
        {
          "text": "Learn more about cyber incident reporting for critical infrastructure assets",
          "url": "entity:node/2111"
        },
        {
          "text": "Further guidance on the Mandatory Cyber Incident Reporting Scheme",
          "url": "https://www.cisc.gov.au/resources-subsite/Documents/mcir-guidance.pdf"
        }
      ],
      "applies_to_sectors": [
        "all"
      ],
      "applies_to_entity_types": [
        "393"
      ],
      "requires_ransom_payment": false,
      "acsc_hash": "5ccec483bec7",
      "last_verified": "2026-04-16",
      "source": "ACSC Single Reporting Portal (verified by 89-query enumeration)"
    },
    {
      "id": "au-aviation-maritime-cyber",
      "jurisdiction": "AU",
      "obligation_name": "Cyber incident affecting an aviation or maritime asset",
      "obligation_type": "Mandatory",
      "regulator": "ASD's ACSC + Department of Home Affairs",
      "who_applies_to": "Aviation, maritime and offshore industry participants.",
      "trigger_condition": "Significant or relevant impact from a cyber incident on an aviation or maritime asset.",
      "timeframe": "A ‘significant impact’ must be reported within 12 hours, and a ‘relevant impact’ must be reported within 72 hours of the industry participant becoming aware of the incident.",
      "timeframe_sort_hours": 12,
      "how_to_report": {
        "method": "Online form (with consent to share with Home Affairs)",
        "url": "https://www.cyber.gov.au/report-and-recover/report",
        "phone": "1300 292 371",
        "email": null
      },
      "legislative_basis": "Security of Critical Infrastructure Act 2018 (SOCI Act)",
      "description": "You must report a cyber-security incident to both the ASD’s ACSC and the Department of Home Affairs. You can submit a report electronically through the ASD’s ACSC and provide consent for that report to be shared with the Department of Home Affairs. If you do not provide your consent, you will need to make a separate report to the Department of Home Affairs. If you have received an INC number from ASD's ACSC you may have already completed this reporting requirement.",
      "penalty": null,
      "learn_more_links": [
        {